{
  "verifier_version": "witnessops.verifier.v0",
  "status": "valid",
  "workflow_class": "privileged_access_approval",
  "proof_run_id": "pr_20260424_privileged_access_001",
  "checks": {
    "receipt_signature": { "status": "passed" },
    "manifest_hash": { "status": "passed" },
    "artifact_hashes": { "status": "passed" },
    "schema_validation": { "status": "passed" }
  },
  "outcome": "pass",
  "failure_states": []
}
